id,name,description,price,url,rate,category,source
739345,Bột Giặt Tide Trắng Sạch Chuyên Dụng (6kg),Số lượng quà tặng sẽ thay đổi tùy theo chương trìnhBao bì thay đổi theo từng đợt nhập hàngHạn sử dụng 3 năm kể từ ngày sản xuất in trên bao bìBột Giặt Tide Trắng Sạch Chuyên Dụng (6kg) sử dụng các ...,185000.0,https://tiki.vn/product-p739345.html?spid=75405865,4.8,Đồ Chơi - Mẹ & Bé,TIKI
49957356,Bánh Ăn Dặm Gạo Lứt Phô Mai Bebedang Cho Bé Nhập Khẩu Hàn Quốc,"SẢN PHẨM BÁNH ĂN DẶM GẠO HỮU CƠ BEBEDANG* Đặc tính sản phẩm : Bánh gạo ăn dặm Bebedang là sử dụng trên 99% gạo hữu cơ xuất xứ Hàn quốc được trồng trên đất không sử dụng thuốc sâu, phân bón hóa học t...",55000.0,https://tiki.vn/product-p49957356.html?spid=205287519,4.8,Đồ Chơi - Mẹ & Bé,TIKI
57349343,"Combo 10 Gói Cháo Tươi Cây Thị: 2 Gà Ác Đậu Xanh, 2 Thịt Bò, 2 Thịt Heo, 1 Cá Hồi, 1 Cá Lóc, 1 Lươn Đậu Xanh, 1 Rau Củ",Combo 10 gói cháo tươi Cây Thị gồm:- 02 cháo tươi thịt heo- 02 cháo tươi thịt bò- 02 cháo tươi gà ác đậu xanh- 01 cháo tươi rau củ- 01 cháo tươi lươn đậu xanh- 01 cháo tươi cá lóc- 01 cháo tươi...,200100.0,https://tiki.vn/product-p57349343.html?spid=57349345,5.0,Đồ Chơi - Mẹ & Bé,TIKI
186095383,"Combo 3 lon sản phẩm dinh dưỡng y học Nutren Junior cho trẻ từ 1-12 tuổi 850g tăng trưởng 3 chuẩn: Thế chất, Đề kháng, Tư duy - Tặng khăn choàng tắm bé con voi","NUTREN JUNIOR là công thức dinh dưỡng đầy đủ và cân đối dành cho trẻ từ 1-12 tuổi bị suy dinh dưỡng hoặc có nguy cơ suy dinh dưỡng, trẻ có nhu cầu năng lượng cao, hỗ trợ dinh dưỡng hồi phục ...",1840000.0,https://tiki.vn/product-p186095383.html,5.0,Đồ Chơi - Mẹ & Bé,TIKI
249168957,Dụng cụ vệ sinh bình sữa Wesser,"Giới thiệu sản phẩm Dụng cụ vệ sinh đa năng: Sử dụng loại mút cao cấp có độ dai vượt trội, siêu bền theo công nghệ của Đức- Mút giúp nhẹ nhàng rửa sạch các vết bẩn bám trên bình mà ko làm trầy bì...",61060.0,https://tiki.vn/product-p249168957.html?spid=249168960,5.0,Đồ Chơi - Mẹ & Bé,TIKI
217139823,Nước lau sàn chuyên dụng dành cho Dreame - Phụ kiện chính hãng, Nước lau sàn chuyên dụng Dreame 500ml-------------------------------------------------------------------------------------------------------------------------------------------------------------...,349000.0,https://tiki.vn/product-p217139823.html?spid=217139825,4.6,Đồ Chơi - Mẹ & Bé,TIKI
269990427,Sữa Bột Anlene Gold 5X Hương Vanilla (Hộp giấy 1200g),"Anlene Gold 5X/Anlene 5 khoẻ vàng mới là sản phẩm sữa chứa phức hợp dinh dưỡng với hoạt chất MFGM được kiểm nghiệm lâm sàng giúp cải thiện toàn diện hệ vận động: Cơ khỏe, Xương chắc, Khớp linh hoạt, ...",659000.0,https://tiki.vn/product-p269990427.html?spid=269990428,4.7,Đồ Chơi - Mẹ & Bé,TIKI
201001133,Balo học sinh cấp 1 cặp sách trẻ em đi học tiểu học lớp 1 lớp 2 cho bé trai gái Bibobaby 1413,THÔNG TIN SẢN PHẨM:Balo học sinh cấp 1 cặp sách trẻ em đi học tiểu học lớp 1 lớp 2 cho bé trai gái Bibobaby 1413Màu sắc: Ngựa Pony hồng - tím | Thỏ hồng | Mèo hồng | Hươu cao cổ | Phi hành gia | ...,205000.0,https://tiki.vn/product-p201001133.html?spid=201001135,5.0,Đồ Chơi - Mẹ & Bé,TIKI
75555110,Thuốc Diệt Gián Nhật Bản HT SYS EARTH - Hộp 12 Viên - Cách Diệt Gián An Toàn Hiệu Quả Cho Con Người Và Vật Nuôi,"Thuốc Diệt Gián Dạng Viên EARTH xuất xứ từ Nhật Bản, là loại thuốc diệt gián phổ biến và được sử dụng rộng rãi nhất. Thành phần của thuốc bao gồm fipronil và hương liệu không gây dị ứng, thích hợp vớ...",83000.0,https://tiki.vn/product-p75555110.html?spid=75555111,4.6,Đồ Chơi - Mẹ & Bé,TIKI
118958121,Combo 2 Tã/bỉm dán Merries Jumbo Đủ Size M76/L64,...,1020000.0,https://tiki.vn/product-p118958121.html?spid=118958123,4.7,Đồ Chơi - Mẹ & Bé,TIKI
172835743,Combo 05 gói Thuốc diệt chuột SINH HỌC thế hệ mới Broma 0.005ab gói 50g,"Thuốc diệt chuột SINH HỌC thế hệ mới Broma 0.005ab (05gói x50g)Broma 0,005 AB là thuốc diệt chuột nhóm chống đông máu thế hệ mới gây xuất huyết nội tạng.-Chỉ sau 1 lần ăn chuột sẽ chết từ 90-100% tr...",70000.0,https://tiki.vn/product-p172835743.html?spid=172835745,4.5,Đồ Chơi - Mẹ & Bé,TIKI
72875812,"Combo 20 gói khăn giấy lau tay Roto eco20-2 hai lớp 100% bột giấy nguyên sinh, dài 20cm, họa tiết chấm bi xốp, thấm hút 2 chiều, gồm 102 tờ/gói",# THÔNG TIN SẢN PHẨM- Tên sản phẩm: Khăn giấy rút lay tay đa năng ROTO ECO RTE20-2- Thành phần: 100% bột giấy nguyên sinh - Quy cách: 102 tờ/ 2 lớp /gói.- Kích thước: 196*200mm# ĐẶC ĐIỂM NỔI BẬT:+ Đả...,252000.0,https://tiki.vn/product-p72875812.html?spid=72875813,4.8,Đồ Chơi - Mẹ & Bé,TIKI
187636884,"Chăn Mền Cotton Đũi cho bé Thu Hè, chăn mền điều hòa trẻ em mỏng thoáng mát - Tặng 10 chiếc chun","Chăn Mền Cotton Đũi cho bé Thu Hè, chăn mền điều hòa trẻ em mỏng thoáng mátChất liệu: Cotton ĐũiKích thước: 110x135cmVới đặc điểm mỏng nhẹ phù hợp cho các bé mang đi lớp,Chăn được trần lớp bông mỏng ở...",85000.0,https://tiki.vn/product-p187636884.html?spid=187636888,4.8,Đồ Chơi - Mẹ & Bé,TIKI
76121717,Sữa bột Vinamilk Optimum Gold Step 4 Hộp Thiếc 850g,"Sữa Bột Optimum Gold Step 4 Hộp Thiếc 850g với công thức dễ tiêu hóa, là nền tảng cho việc hấp thu các dưỡng chất thiết yếu cho trẻ từ 2 tuổi, giúp tăng cường sức đề kháng, phát triển não bộ và thể ch...",319000.0,https://tiki.vn/product-p76121717.html?spid=76121718,4.7,Đồ Chơi - Mẹ & Bé,TIKI
40750358,Bộ 2 Túi Sữa Bột Nguyên Kem Nutifood (400g),Sữa Bột Nguyên Kem Nutifood (400g) được sản xuất bằng công thức độc quyền Health Max cải tiến mới với hệ dưỡng chất cân bằng hoàn hảo. Sản phẩm cung cấp đầy đủ dưỡng chất thiết yếu cho cơ thể phát tri...,154000.0,https://tiki.vn/product-p40750358.html,4.6,Đồ Chơi - Mẹ & Bé,TIKI
271329976,Sữa bột công thức S-26 ULTIMA 1 350G với hợp chất NUTRILEARN CONNECT cho bé 0 - 12 tháng tuổi,"Sản phẩm dinh dưỡng công thức Nestlé S-26 ULTIMA 1 350GVới hơn 155 năm kinh nghiệm, Nestlé không ngừng tiên phong nghiên cứu & sáng tạo trong lĩnh vực dinh dưỡng dành cho trẻ nhỏ. Nestlé S-26 Ult...",372000.0,https://tiki.vn/product-p271329976.html?spid=271329977,0.0,Đồ Chơi - Mẹ & Bé,TIKI
122532166,Gói Hút Ẩm 5 Gram đóng gói  1000Gram Silicagel - hạt hút ẩm thực phẩm quần áo giày dép máy ảnh hoa khô,Gói Hút Ẩm 500G quy cách 5 Gram Silicagel - hạt hút ẩm thực phẩm quần áo giày dép máy ảnh hoa khô ỨNG DỤNG CỦA HẠT HÚT ẨM SILICAGEL: ứng dụng chủ yếu là hút hơi nước trong môi trường nhất định.1) Th...,20000.0,https://tiki.vn/product-p122532166.html?spid=122532168,5.0,Đồ Chơi - Mẹ & Bé,TIKI
250089221,"Túi Ủ Bình Sữa Thông Minh Cho Bé Fatzbaby Di Động Giữ Nhiệt Hâm Nóng Bình Sữa Túi Hâm Sữa Usb Giữ Ấm Bình Sữa Cầm Tay Túi Hâm Nóng Sữa, Thức Ăn Sạc Usb Tiện Lợi Giúp Giữ Nhiệt Sữa Trong Thời Gian Dài","Dụng cụ hâm sữa xách tay️Dụng cụ làm bằng vải polyester chịu nhiệt chất lượng cao, mặt trong được lót lớp tráng bạc gíup cách nhiệt tốt.️Giữ nhiệt ở phạm vi nhiệt độ: 34° C ~ 42 ° C.️Di...",299000.0,https://tiki.vn/product-p250089221.html?spid=250089222,5.0,Đồ Chơi - Mẹ & Bé,TIKI
78973653,"Đồ chơi lắp ghép máy bay  KAVY có 39 chi tiết có âm thanh và đèn sáng, nhựa nguyên sinh an toàn, có hướng dẫn lắp đặt","Bộ đồ chơi lắp ghép máy bay có 39 chi tiết có âm thanh và đèn sángTHÔNG TIN SẢN PHẨM - Số mảnh ghép: 39 chi tiết- Kích thước sản phẩm : 25 x 15 x 5 cm- Chất liệu: Chất liệu nhựa ABS cao cấp, an toàn t...",150000.0,https://tiki.vn/product-p78973653.html?spid=78973655,4.8,Đồ Chơi - Mẹ & Bé,TIKI
197740208,"Muối rửa ly Somat Spezial Salz 1,2 Kg","Muối rửa bát Somat được sản xuất tại Đức, là sản phẩm chuyên dụng phù hợp với đa dạng các loại máy rửa bát như Elextrolux, Malloca, Ariston, Fagor…Muối rửa bát Somat không tạo bọt, giúp cho máy rửa b...",81600.0,https://tiki.vn/product-p197740208.html?spid=197740211,4.8,Đồ Chơi - Mẹ & Bé,TIKI
195332401,"Khăn ướt Mamamy Tropical 100% sợi tự nhiên ngừa hăm, rôm sảy kháng khuẩn giữ ẩm cho bé (Gói 60/90 tờ)",Khăn ướt mamamy tropical 60/90 tờ tinh dầu cúc vạn thọ ngừa hăm & rôm sảy đồng thời giữ ẩm cho làn da của bé1.Ngoài việc sở hữu 02 thành phần chăm sóc da độc đáo:● Chất ngừa hăm &...,35000.0,https://tiki.vn/product-p195332401.html?spid=201670994,5.0,Đồ Chơi - Mẹ & Bé,TIKI
139247884,"BỘ CỜ VUA NAM CHÂM, Chuẩn Quốc Tế, Loại Cao Cấp, Bàn Cờ Vua Đẹp, Nhựa An Toàn, Đồ Chơi Trí Tuệ o","BỘ CỜ VUA Có NAM CHÂM là loại Cờ Vua chuẩn Quốc Tế, Loại Cao Cấp, được sản xuất từ phôi Nhựa Nguyên sinh, An Toàn cho trẻ em và người sử dụng.BỘ CỜ VUA CÓ NAM CHÂM chuẩn QUỐC TẾ là một bộ môn thể th...",140000.0,https://tiki.vn/product-p139247884.html?spid=139247890,5.0,Đồ Chơi - Mẹ & Bé,TIKI
576817,Tã Dán Cao Cấp Moony Nhật Bản L54 (54 Miếng ),"Tã Dán Moony Size L54 Miếng là sản phẩm cao cấp được sản xuất theo công nghệ hiện đại nhất hiện nay, đáp ứng được tất cả những yêu cầu về chất lượng cũng như tiêu chuẩn về an toàn cho bé yêu của bạn. ...",287900.0,https://tiki.vn/product-p576817.html?spid=25494894,4.8,Đồ Chơi - Mẹ & Bé,TIKI
74879546,"Bộ đồ chơi nấu ăn nhà bếp KAVY với 36 chi tiết cao 63 cm có nhạc và đèn, nhựa nguyên sinh an toàn",BỘ ĐỒ CHƠI NẤU ĂN CHO BÉ CÓ NHẠC VÀ ĐÈNƯU ĐIỂM : - Bộ đồ chơi bán hàng trái cây có 51 chi tiết có xe đẩy rất tiện lợi bé có thể mang đi mọi lúc mọi nơi và thu gọn sạch sẽ sau mỗi lần chơi giúp bé học ...,360000.0,https://tiki.vn/product-p74879546.html?spid=74879547,4.5,Đồ Chơi - Mẹ & Bé,TIKI
205290063,"Muối rửa bát Finish 4kg - Muối finish 4.0kg cho Máy rửa bát chén ly, Muối rửa chén finish hay gọi là Muối làm mềm nước Finish gói 1.5kg, 4 kg, 1.2kg","Muối rửa bát Finish 4.0 kgKhi sở hữu một chiếc máy rửa bát, chắc hẳn bạn cũng biết muối rửa bát finish là chất phụ gia bắt buộc phải sử dụng để đảm bảo máy luôn hoạt động tốt. Khách hàng nào cũng muố...",137724.0,https://tiki.vn/product-p205290063.html?spid=207284474,1.0,Đồ Chơi - Mẹ & Bé,TIKI
120170570,"Xe chòi chân kiêm xe đạp cho bé Motion - Xe thăng bằng khung thép, ghế da cho trẻ em DC018","- Màu sắc: Đỏ, Trắng, Xanh- Trọng lượng xe: 3kg- Khả năng chịu lực: 45kg- Kích thước xe khi lắp: Dài 69cm x Rộng 35cm x Cao 50cm- Chiều cao từ mặt đất đến yên xe: 32 -> 35cm (có thể điều chỉnh ...",238000.0,https://tiki.vn/product-p120170570.html?spid=270798622,0.0,Đồ Chơi - Mẹ & Bé,TIKI
36704904,Xe 3 bánh đôi -Xe 3 bánh xích lô mâu mới nhất (giao mầu bé gái),"Xe Đạp Xích Lô 2 Ghế Cho Bé 2 - 6 TuổiBên cạnh việc cho trẻ ăn các chế độ gồm dinh dưỡng hợp lý, ngủ đủ giấc và có sức khỏe tinh thần tốt, chúng ta phải thường xuyên thúc đẩy các bé tập luyện thể dục...",449000.0,https://tiki.vn/product-p36704904.html?spid=74766308,0.0,Đồ Chơi - Mẹ & Bé,TIKI
89802357,Nước Rửa Bát Hữu Cơ ENZYCO Lên Men Từ Bồ Hòn Và Dứa Không Chất Tẩy Công Nghiệp Không Gây Dị Ứng Cho Tay An Toàn Cho Trẻ Nhỏ Mùi Hương - Chai Hương Cam 1L,"NƯỚC RỬA CHÉN SINH HỌC ENZYCO LÊN MEN TỪ DỨA VÀ BỒ HÒN - CHAI HƯƠNG CAM 1LBạn thân mến, Lần đầu sử dụng ENZYCO, chắc hẳn bạn sẽ ngửi thấy hương vị lạ lẫm từ những giọt chất lỏng đặc quánh nhàn nhạt ấ...",139000.0,https://tiki.vn/product-p89802357.html?spid=89802359,4.8,Đồ Chơi - Mẹ & Bé,TIKI
135478535,Nước giặt Dnee cho bé chai 3000ml-hàng chính hãng có hoá đơn,LƯU Ý: BAO BÌ CÓ THỂ THAY ĐỔI TÙY THEO TỪNG ĐỢT NHẬP HÀNG TUY NHIÊN CÁC SẢN PHẨM NHÃN HIỆU D-NEE DO SHOP BABY THIÊN PHÚC CUNG CẤP ĐỀU PHẢI CÓ TEM PHỤ CỦA CÔNG TY TNHH DV TM & XNK ĐẠI THỊNH.Dung D...,189000.0,https://tiki.vn/product-p135478535.html?spid=183029147,5.0,Đồ Chơi - Mẹ & Bé,TIKI
174557328,"Bộ nệm gối cho bé đi học mẫu giáo 80x120cm, vải cotton satin hàn quốc đẹp, mềm mát, họa tiết sắc nét",Bộ nệm gối cho bé đi học mẫu giáo vải cotton satin hàn quốc mềm mại và mát - giúp bé yêu ngon giấc tại trường- Bé yêu luôn cần ngủ đủ giấc để phát triển toàn diện về thể chất và trí tuệ. Để giúp ...,398000.0,https://tiki.vn/product-p174557328.html?spid=174557332,5.0,Đồ Chơi - Mẹ & Bé,TIKI
270982077,"Xe trượt Scooter cho bé, xe Scooter trẻ em cao cấp có đèn cộng ghế ngồi","* ĐẶC ĐIỂM NỔI BẬT:- Siêu xe cực kì phù hợp với các bé, thay thế 3 in 1 các loại xe đồ chơi khác.- Yên nhún làm bằng nhựa cao cấp- Khung sắt sơn chắc chắn- Bánh to - 2 bánh trước hỗ trợ chống trượ...",299000.0,https://tiki.vn/product-p270982077.html?spid=272730239,0.0,Đồ Chơi - Mẹ & Bé,TIKI
74462108,Máy hâm sữa & tiệt trùng- Mono 6 - Fatzbaby FB3001TN, 1. THIẾT KẾ & CÔNG DỤNG ĐẶC BIỆT:  lớp phủ bảo vệ đế đun nóng • Dễ dàng vệ sinh • Chống thấm • Chống mài mòn • Ngăn cặn bám và ngăn ngừa chập mạch.Đây là  mộ...,325000.0,https://tiki.vn/product-p74462108.html?spid=83677402,4.7,Đồ Chơi - Mẹ & Bé,TIKI
187577100,[Mẫu mới 2022]Quần lót bé gái sét 3 chiếc tam giác siêu đẹp chất cotton mềm mịn kháng khuẩn cho bé từ 2-11 tuổi,"[Mẫu mới 2021]Quần lót bé gái sét 3 chiếc siêu đẹp chất cotton mềm mịn kháng khuẩn cho bé từ 2-11 tuổiQUẦN CHIP BÉ GÁI 2 tuổi - 11 tuổi Chất liệu: chất cotton cao cấp cực mềm mịn, co giãn thoáng mát...",88000.0,https://tiki.vn/product-p187577100.html?spid=187577128,4.5,Đồ Chơi - Mẹ & Bé,TIKI
77032355,Bài Poker Texas Hold'em Hold em Siêu bền siêu đàn hồi,"Bài Poker Texas Hold'em Hold em Siêu bền siêu đàn hồiBài nhựa Poker Texas Hold'em:- Nhãn hiệu: Poker Texas Hold'em- Xuất xứ: Trung Quốc- Chất liệu: 100% plastic (nhựa PVC)- Kích thước: 6,3 x 8,8 x 0...",90000.0,https://tiki.vn/product-p77032355.html?spid=77032357,4.5,Đồ Chơi - Mẹ & Bé,TIKI
271338718,"Xe trượt scooter cho bé, CÓ ĐÈN ,NHẠC, XE SCOOTER CÓ TAY ĐẨY, XE CHÒI CHÂN , cho bé từ 1-10 tuổi",Xe trượt Scooter  3 bánh phát sáng cho béThông tin chi tiết sản phẩm Xe trượt Scooter 3 bánh phát sáng :• Kích thước : Dài 59 cm x Rộng 30cm x Dài 73cm khi mở hết cỡ.• Màu sắc ...,286000.0,https://tiki.vn/product-p271338718.html?spid=272186720,0.0,Đồ Chơi - Mẹ & Bé,TIKI
74458728,Thuốc diệt chuột Storm 0.005% (1 gói x 20 viên) (bao bì mới),"Thuốc diệt chuột Storm – Thuốc diệt chuột thế hệ mới – Không cần trộn thêm mồi – Diệt chuột ngay trong lần ăn bả đầu tiênĐẶC TÍNH NỔI TRỘI:- Sử dụng ngay, rất tiện lợi, không cần trộn mồi.- Thuốc h...",40000.0,https://tiki.vn/product-p74458728.html?spid=173758486,5.0,Đồ Chơi - Mẹ & Bé,TIKI
210879521,"Bàn Cờ Tướng Mini Nam Châm 2 Mặt Tiện Ích, Cờ Tướng Nam Châm Bỏ Túi - Cờ Tướng Bàn Là Hộp Đựng, Bộ cờ tướng mini bỏ túi bằng nam châm, bàn cờ gập gọn 15x16Cm - Hàng chính hãng dododios",Cờ Tướng Nam Châm Bỏ Túi - Cờ Tướng Bàn Là Hộp Đựng - Hàng chính hãngCờ Tướng Nam Châm Cao CấpCờ Tướng Mini Có Bàn Là Hộp ĐựngChính Hãng dododiosCờ tướng một trò chơi trí tuệ dành cho hai người. Đ...,56000.0,https://tiki.vn/product-p210879521.html?spid=210879522,4.8,Đồ Chơi - Mẹ & Bé,TIKI
108026133,"Xe trượt scooter 3 bánh -Xe Trượt Scooter Trẻ Em Phát Sáng, Có Nhạc Và Đèn Báo, Dành Cho Bé Từ 2-15 Tuổi","Kích thước tay cầm có thể điều chỉnh phù hợp cho các bé từ 1-13 tuổi ( 58cm-68cm-74cm)Thiết kế chắc chắn, an toàn và tiện dụng có thể gấp gọn mang đi mọi nơiChất liệu: Nhựa PP cao cấp, bền bỉ, khung k...",585000.0,https://tiki.vn/product-p108026133.html?spid=198869260,0.0,Đồ Chơi - Mẹ & Bé,TIKI
245766174,Sticker hoạt hình in nổi 3D.Miếng dán sticker cho bé,"Sticker nổi hình ,tinh nghịch, dễ thương, xinh xắn.Mẫu mã đa dạng Mỗi đợt nhập hàng mẫu mã có thể sẽ khác nhau nhé khách iu Dùng để trang trí trên tập , sách, máy tính, điện thoại,Sticker có màu sắc t...",1000.0,https://tiki.vn/product-p245766174.html?spid=245769484,0.0,Đồ Chơi - Mẹ & Bé,TIKI
248715602,Túi Nước giặt OMO Matic Hương Cam & Hổ phách Chuyên gia giữ màu Cho máy giặt cửa trên 3.6kg,"OMO MATIC HƯƠNG CAM & HỔ PHÁCH MỚI CHUYÊN GIA GIỮ MÀU – LỰA CHỌN HOÀN HẢO CHĂM SÓC QUẦN ÁO CHO GIA ĐÌNHOMO Matic lần đầu tiên giới thiệu Hương Cam & Hổ phách ấm áp và sang trọng, lưu hương bề...",175000.0,https://tiki.vn/product-p248715602.html?spid=248715604,5.0,Đồ Chơi - Mẹ & Bé,TIKI
104144223,Tắm gội dịu nhẹ Pigeon Hoa hướng dương 200ml/700ml (MẪU MỚI),"       * Dầu ép từ hạt hoa hướng dương có hàm lượng vitamin A, D, C và E cao, có tác dụng dưỡng ẩm tuyệt vời cho làn da. Tinh dầu hoa hướng dương thật sự là một loại tinh dầu có thể sử dụng một cá...",65000.0,https://tiki.vn/product-p104144223.html?spid=248872330,5.0,Đồ Chơi - Mẹ & Bé,TIKI
70497752,"BOBBY TẢ QUẦN XXXL24 (SIZE XXXL, 24 MIẾNG )",Bao bì sản phẩm có thể thay đổi tùy theo đợt nhập hàngTừ tập đoàn sản xuất tã em bé số 1 Nhật BảnRãnh thấm kim cươngThun chân & thun hông cong ôm mềm mạiVừa vặn ngăn trànKhô thoáng ngăn hằm ...,202000.0,https://tiki.vn/product-p70497752.html,4.8,Đồ Chơi - Mẹ & Bé,TIKI
186118355,Sữa bột Vinamilk Dielac Alpha Gold 4 1400g (cho trẻ từ 2- 6 tuổi),"Dielac Alpha Gold 4 với công thức COMPLET-IQ hỗ trợ PHÁT TRIỂN TOÀN DIỆN, bổ sung Sữa non 24h(*) nhập khẩu từ Mỹ giúp tăng sức đề kháng, cùng lợi khuẩn hỗ trợ hệ tiêu hóa khỏe; DHA, Choline, Lutein hỗ...",421000.0,https://tiki.vn/product-p186118355.html,5.0,Đồ Chơi - Mẹ & Bé,TIKI
55208639,"Đồ chơi lắp ghép,xếp hình Qman 4801: Phòng của bé gái","Bộ đồ chơi cho bé gái: Căn phòng bé gái biến đổi 3 trong 1.Thể loại: xếp hình, lắp ghép.Thiết kế vô cùng đặc biệt: có thể lắp ghép biến đổi 3 mẫu phòng và nội thất khách nhau trong cùng 1 bộ đồ chơ...",169000.0,https://tiki.vn/product-p55208639.html?spid=55208640,4.8,Đồ Chơi - Mẹ & Bé,TIKI
144338095,"Xe trượt Scooter cho bé, Xe scooter cho bé, trẻ em cao cấp","Chất liệu: nhựa PP, Nhôm chắc chắn, an toàn.Trọng lượng xe: 2,2kgPhần xe được thiết kế chịu được trọng lượng tới 30KgCổ xe có thể nâng từ 60 - 74cmKich thước: 29,5x50Thích hợp cho những bé từ 2 - 6 tu...",349000.0,https://tiki.vn/product-p144338095.html?spid=207547566,0.0,Đồ Chơi - Mẹ & Bé,TIKI
259770909,"Cầu trượt cho bé, cầu tuột trẻ em khủng long","       Chơi cầu trượt: Máng trượt được thiết kế lượn sóng giúp bé bay bổng hơn khi trượt, thích thú hơn khi chơi.   Chơi leo cầu thang: Cầu thang có 4 bậc được thiết kế vững chãi, bé có thể leo l...",449000.0,https://tiki.vn/product-p259770909.html?spid=271246837,0.0,Đồ Chơi - Mẹ & Bé,TIKI
145488592,"Thuốc diệt muỗi, kiến FENDONA 10SC","       Thành phần: Alpha- C%   ĐẶC TÍNH VƯỢT TRỘI   • Hiệu lực phun tồn lưu kéo dài từ 4 - 5 tháng trên nhiều bề mặt phun khác nhau: gạch, đất, vôi, sơn nước, xi măng, gỗ,   • Không mùi, không ...",20000.0,https://tiki.vn/product-p145488592.html?spid=213738322,5.0,Đồ Chơi - Mẹ & Bé,TIKI
205293613,"combo viên rửa bát finish 110 viên+nước làm bóng finish 800ml+muối rửa bát finish 1,5kg dùng cho máy rửa bát","Combo: Viên rửa bát Finish 110 viên + Muối Finish 1.5kg+bóng 750ml- Là combo chất tẩy rửa ""Đơn giản và Hiệu quả"", thương hiệu của CHLB Đức và sản xuất tại Liên minh Châu Âu- Viên rửa...",525661.0,https://tiki.vn/product-p205293613.html?spid=208237977,5.0,Đồ Chơi - Mẹ & Bé,TIKI
262663198,Máy hâm sữa & tiệt trùng điên tử - Mono 7,MÔ TẢ 1. THIẾT KẾ & CÔNG DỤNGĐẶC BIỆT: Lớp phủ bảo vệ đế đun nóngDễ dàng vệ sinhChống thấmChống mài mònNgăn cặn bám và ngăn ngừa chập mạch.Đây là  m...,450000.0,https://tiki.vn/product-p262663198.html?spid=262663199,5.0,Đồ Chơi - Mẹ & Bé,TIKI
215466253,Viên rửa bát Finish Nhật bản 150 viên - Viên finish power cube 150v dùng cho máy rửa bát chén loại nhỏ từ 6 - 8 - 9 -10 bộ bát đĩa,Viên rửa bát Finish Nhật 150 viên Cách sử dụng Viên rửa bát Finish Nhật 150 viênViên rửa bát finish power cube 150 viên quý khách hàng sử dụng máy rửa bát loại bé 6 bộ không cần phải lo lắng vì sự...,155541.0,https://tiki.vn/product-p215466253.html?spid=215532022,0.0,Đồ Chơi - Mẹ & Bé,TIKI
115472982,COMBO 10 GIẤY VỆ SINH CUỘN LỚN SENTA 600G CẢI TIẾN MỚI ( 2 LỚP ),"Lưu ý: Senta đồng hành xu hướng “Bảo vệ môi trường thế giới”. Cam kết 100% không chất tẩy trắng nên sẽ có màu đặc trưng của giấy. Nay đã cải tiến chất lượng giấy dai, mềm cao cấp hơn - GIÁ THÀNH KHÔNG...",284000.0,https://tiki.vn/product-p115472982.html?spid=115472983,4.5,Đồ Chơi - Mẹ & Bé,TIKI
197344929,Cốc tập uống 3 giai đoạn Richell phiên bản mới cho bé từ 6 tháng tuổi (có 3 màu lựa chọn),"Đặc Điểm Cấu Tạo Cốc Tập Uống 3 Giai Đoạn Richell- Cốc tập uống 3 giai đoạn Richell dựa trên những nghiên cứu, quan sát về sự phát triển của trẻ nhỏ để cho ra những thiết kế khoa học nhất theo từng ...",215000.0,https://tiki.vn/product-p197344929.html?spid=197344931,5.0,Đồ Chơi - Mẹ & Bé,TIKI
98161309,"Gối Cao Su Non Cho Em Bé Loại Cao Cấp Chính Hãng Tila-Tila Thương Hiệu Đức Mã TG02 Chống Méo Đầu, Bẹp Đầu, Nghẹo Cổ, Còm Lưng Bé","Gối Cho Trẻ Sơ Sinh Cao Cấp Tila-Tila Thương Hiệu Đến Từ Đức - Chất Liệu 100% Cotton Luôn Thoáng Mát Cho Trẻ, Chống Méo Đầu, Bẹp Đầu, Nghẹo Cổ, Còm Lưng Bé.Thông tin chi tiết về sản phẩm gối em bé:...",352000.0,https://tiki.vn/product-p98161309.html?spid=98161313,4.5,Đồ Chơi - Mẹ & Bé,TIKI
205541313,"Quần lót bầu , chip bầu cạp chéo A09 THÔNG HƠI - KHÁNG KHUẨN - THOÁNG KHÍ - SIÊU MỀM MẠI","Quần lót bầu , chip bầu cạp chéo A09 THÔNG HƠI - KHÁNG KHUẨN - THOÁNG KHÍ - SIÊU MỀM MẠIA09 với chất liệu mỏng và mềm mại có khả năng thấm hút mồ hôi nhanh chóng là sự lựa chọn hoàn hảo cho các bà bầ...",55000.0,https://tiki.vn/product-p205541313.html?spid=205541316,5.0,Đồ Chơi - Mẹ & Bé,TIKI
43758887,"Combo 5 đôi tất cotton Chống Trượt 3D cho bé trai, bé gái size 3 tháng đến 8 tuổi, tất mềm, mịn co giãn tốt, hàng Việt Nam chất lượng","Tất vớ cho bé yêu với thành phần 100% cotton, mềm mại, thoáng mát, thấm hút mồ hôi, không gây kích ứng cho làn da mỏng manh của bé yêu.Với công nghệ in từ Hàn Quốc, sử dụng nguyên vật liệu nhập khẩu ...",110000.0,https://tiki.vn/product-p43758887.html?spid=43758889,4.8,Đồ Chơi - Mẹ & Bé,TIKI
