id,name,description,price,url,rate,category,source
80358747,Bộ đồ chơi nhập vai bác sĩ Bowa (chọn mẫu),Bộ đồ chơi nhập vai BOWA – Bộ bác sĩ 34 chi tiết / Cặp bác sĩ 23 chi tiết (BOWA 8102/BOWA 8393P)Bộ đồ chơi nhập vai BOWA chủ đề em tập làm bác sĩ gồm 2 phiên bản:    - BOWA 8102 - Bộ bác sĩ 34 chi t...,219000.0,https://tiki.vn/product-p80358747.html?spid=80358749,4.7,Đồ Chơi - Mẹ & Bé,TIKI
7137433,Sữa bột Ensure hương Vanila 850 Grams cho người lớn tuổi - Nhập khẩu Australia,"Sữa bột Ensure hương Vanila 850 Grams - Nhập khẩu AustraliaMẫu mới Ensure Australia 2018Thương hiệuHãng sữa Abbott được thành lập từ năm 1888, là công ty chăm sóc sức khỏe hàng đầu thế giới: chuyê...",693000.0,https://tiki.vn/product-p7137433.html?spid=57627093,4.7,Đồ Chơi - Mẹ & Bé,TIKI
246206838,Thực phẩm dinh dưỡng Aptamil Đức 800g số 2,Thực phẩm dinh dưỡng  Đức 800g số 2Đối tượng sử dụng: Dùng cho bé 6-12 tháng tuổiCông dụng: Bổ sung các chất  hợp lý cho trẻ trong giai đoạn ăn dặm. Dùng để thay thế bữa ăn cho bé thiếu sua mẹ hay c...,585000.0,https://tiki.vn/product-p246206838.html?spid=246206839,5.0,Đồ Chơi - Mẹ & Bé,TIKI
205822414,Muối Rửa Chén Bát Finish Salt - Bịch 1KG,"* Finish -Thương hiệu viên rửa chén bát bán chạy số 1 toàn cầu. * Finish là thương hiệu dẫn đầu thị trường về rửa chén tự động, được khuyên dùng bởi các nhãn hàng máy rửa chén hàng đầu Bosch, LG, Sha...",129000.0,https://tiki.vn/product-p205822414.html?spid=205822415,4.8,Đồ Chơi - Mẹ & Bé,TIKI
186712674,"Chăn Đắp, Khăn Tắm Và Quấn Ủ Bonny 100% Sợi Tre Lụa 4 Lớp Siêu Mềm, Thấm Hút, An Toàn Cho Làn Da Của Bé Yêu (Kt:1m1x1m2)",Phiên bản khăn/chăn 4 lớp bo viền chất liệu tre lụa này được đặt thứ hạng là phiên bản Pro Max nhé ba mẹ ơi.Tuyệt đỉnh của dòng khăn Bonny luôn ạ. Rất rất nhiều ưu điểm sẽ được liệt kê dần trong bài ...,180000.0,https://tiki.vn/product-p186712674.html?spid=192724498,4.8,Đồ Chơi - Mẹ & Bé,TIKI
152738080,Đồ Chơi LEGO MINECRAFT Phục Kích Sinh Vật Creeper 21177,"Đồ Chơi LEGO MINECRAFT Phục Kích Sinh Vật Creeper 21177Thiết kế bao gồm các nhân vật, phụ kiện và tính năng của Minecraft, LEGO Minecraft Phục Kích Sinh Vật Creeper (21177) là một món quà tuyệt vời d...",333000.0,https://tiki.vn/product-p152738080.html?spid=201161441,5.0,Đồ Chơi - Mẹ & Bé,TIKI
210942910,"Xịt sâu răng Baby's Tooth cho bé Nhật Bản, kem đánh răng nuốt được, xịt chống ngừa sâu răng, hôi miệng, ố vàng, hà mủn, sáng răng trẻ em","- BABY’S TOOTH là sản phẩm xịt ngừa sâu răng, bảo vệ răng với các nguyên liệu nhập khẩu Nhật Bản và các loại thảo mộc tự nhiên Việt Nam.- Đột phá công nghệ nha khoa Nhật Bản với hoạt chất kháng thể ...",185000.0,https://tiki.vn/product-p210942910.html?spid=210137571,5.0,Đồ Chơi - Mẹ & Bé,TIKI
253237508,"Dép trẻ em, cho bé trai và bé gái, kiểu dáng ô tô ngộ nghĩnh đáng yêu, bằng nhựa chống trơn trượt tuyệt đối","Dép cho bé, dép cho bé gái, dép cho bé trai, dép bé gái, dép bé traiBẢNG SIZE:Size 150 (Size 22-23) - Chiều dài bàn chân là 14 cm.Size 160 (Size 24-25) - Chiều dài bàn chân là 15 cmSize 170 (Size 26-...",49500.0,https://tiki.vn/product-p253237508.html?spid=253237512,5.0,Đồ Chơi - Mẹ & Bé,TIKI
58141815,"Bột Thông Tắc Cống, Đường Ống - EcoSock Hộp 0.5Kg - Hàng Chính Hãng Từ Mỹ","Bột Thông Tắc Cống, Đường Ống - EcoSock Hộp 0.5Kg - Hàng Chính Hãng Từ Mỹ1. Xử lý tắc bồn rửa bátVới khả năng đánh bay dầu mỡ, vụn thực phẩm và rác hữu cơ nhanh chóng nên EcoSock là sản phẩm thông ...",335000.0,https://tiki.vn/product-p58141815.html?spid=58141816,4.3,Đồ Chơi - Mẹ & Bé,TIKI
160842683,Bình Đun Và Hâm Nước Pha Sữa Thông Minh FatzBaby SMART2-FB3817TN,Máy hâm nước pha sữa hoạt động 24/24h giúp bạn luôn có nước ấm thích hợp pha sữa cho bé ngay cả khi phải thức dậy lúc nửa đêm. Máy đun và hâm nước pha sữa thông minh  có thể điểu chỉnh nhiệt độ chính ...,822000.0,https://tiki.vn/product-p160842683.html?spid=160842684,5.0,Đồ Chơi - Mẹ & Bé,TIKI
89011676,"Viên Thả Bồn Cầu SPEVI Thương Hiệu Đến Từ Nhật Bản - Dạng Nén Cao Cấp Thế Hệ 2 Giúp Diệt Sạch Vi Khuẩn, Khử Mùi Hiệu Quả Nhờ Hương Chanh Thơm Mát, An Toàn Khi Sử Dụng - Hàng Chính Hãng",Viên Tẩy Vệ Sinh Bồn Cầu Hương Chanh Giúp Diệt Sạch Vi Khuẩn Tẩy Sạch Bồn Cầu Khử Mùi Hiệu Quả Tuyệt Đối An Toàn Sử Dụng - Hàng Chính HãngBạn đang lo ngại rằng nhà vệ sinh của mình luôn có mùi khó c...,63000.0,https://tiki.vn/product-p89011676.html?spid=89011890,4.7,Đồ Chơi - Mẹ & Bé,TIKI
77154216,Vitamin bầu Elevit chính hãng Úc mẫu mới,"Vitamin bà bầu ElevitElevit là sản phẩm chức năng cho mẹ mang thai do hãng Bayer Úc sản xuất. Elevit bầu được đánh giá tốt nhất từ các bà mẹ bỉm sữa Việt, giúp bổ sung các vi chất cần thiê...",1130000.0,https://tiki.vn/product-p77154216.html?spid=77154217,4.8,Đồ Chơi - Mẹ & Bé,TIKI
43282996,"Cờ Vua Nam Châm Cao Cấp 25cm, 32cm, 36cm – Hàng Chính Hãng",Cờ Vua Cao Cấp Amalife – Cờ Vua Nam Châm – Hàng Chính Hãng – Nhiều SizeBộ Cờ Vua Tiêu Chuẩn Quốc Tế Gắn Nam Châm Màu Vàng – Bạc Có 3 KÍCH THƯỚC Lựa Chọn Rộng x Dài x Dày (Cm):Bàn cỡ ĐẠI 4912A: 36...,89000.0,https://tiki.vn/product-p43282996.html?spid=43283002,5.0,Đồ Chơi - Mẹ & Bé,TIKI
54660452,Tã/Bỉm dán Moony Natural Size L- 38 miếng( bé 9-14 kg),Bỉm Dán Moony Natural Nhật Bản Size L38 THÔNG TIN CHI TIẾT Thương hiệuMoony NaturalKích thướcSize L (9-14kg)Quy cách đóng gói (pack)38 packChất liệuSợi bôngXuất xứ thương hi...,299890.0,https://tiki.vn/product-p54660452.html?spid=201475524,5.0,Đồ Chơi - Mẹ & Bé,TIKI
108915932,Bộ 3 Bình Trữ Sữa Mẹ FATZBABY 150ml FB0120N,"1. CÔNG DỤNG- Sử dụng để trữ sữa mẹ, có thể làm bình hút trực tiếp từ máy hút sữa thông qua một chuyển đổi cổ bình. Hoặc có thể làm bình sữa khi lắp với núm ti cổ rộng. Lưu ý: Sản Phấm có thể tha...",105000.0,https://tiki.vn/product-p108915932.html?spid=203759830,0.0,Đồ Chơi - Mẹ & Bé,TIKI
99669795,03 bộ tranh xếp hình 70 mảnh ghép khổ A3 – đồ chơi trí tuệ cho bé từ 3 tuổi – Combo 15,"THÔNG TIN SẢN PHẨM:Combo 3 bộ gồm: Nàng tiên cá, Cinderella, Sắc màu đại đươngSố mảnh ghép: 70 mảnhKích thước hình xếp: khổ A3 36 x 26cm – Trình bày: Dạng bảngXuất xứ: Việt NamTuổi chơi thích hợ...",85000.0,https://tiki.vn/product-p99669795.html?spid=99669796,5.0,Đồ Chơi - Mẹ & Bé,TIKI
173424981,"Robot lắp ráp biến hình Transformer, Optimus - Bumblebee (Hình ảnh đẹp)",       Robot lắp ráp biến hình Tranformer (Gồm Optimus - Bumblebee - Tyrannosaurux - Triceratops và 2 phiên bản hợp kim Dark Sky gồm 2 màu Đỏ và Đen-Xanh (Hình ảnh đẹp)   - Mô hình lắp ráp 2 tron...,152100.0,https://tiki.vn/product-p173424981.html?spid=173424985,4.5,Đồ Chơi - Mẹ & Bé,TIKI
178027318,"Thanh chắn giường cho bé bản Nâng cấp, dày, cao hơn, tính năng hạ 1 bên, cao 103cm ( 1 thanh)","Mô Tả Sản PhẩmThanh chặn giường ngày càng trở nên cần thiết cho các bà mẹ bỉm sữa về tính an toàn, giá thành rẻ và thiết kế ngày càng ưu việt thuận tiện. Nếu mẹ đã từng phải nơm nớp ngủ không ngo...",399000.0,https://tiki.vn/product-p178027318.html?spid=178027320,0.0,Đồ Chơi - Mẹ & Bé,TIKI
215119215,Combo 2 Dầu Gội Giúp Tóc Chắc Khỏe Cho Bé Gái Johnsons Active Kids Strong Healthy Shampoo - Dung tích 500mlx2,"Khi bắt đầu biết đi, vận động và tiếp xúc với môi trường bên ngoài nhiều hơn, nhu cầu và chế độ chăm sóc của các bé sẽ thay đổi. Vì vậy sản phẩm dầu gộ riêng cho bé sẽ đảm bảo tóc óng mượt, chắc khỏe,...",189000.0,https://tiki.vn/product-p215119215.html?spid=215119216,5.0,Đồ Chơi - Mẹ & Bé,TIKI
271437031,"Bộ gối nệm cho bé đi học ,nhiều kích cỡ, vải Tencel cực mềm mát, họa tiết đáng yêu"," Bộ gối nệm cho bé đi học, vải tencel siêu mềm mát, giúp bé yêu ngủ ngon hơnMột giấc ngủ sâu và dài góp phần quan trọng sẽ đem tới sự thay đổi lớn về tâm trạng và cảm hứng học tập cho bé. Tuy nhiên...",349000.0,https://tiki.vn/product-p271437031.html?spid=271437039,0.0,Đồ Chơi - Mẹ & Bé,TIKI
100253768,Sáp thơm khử mùi Pure Aroma Mr Fresh 230g ( 4 mùi  ),"Thông tin sản phẩm: Sáp thơm phòng khử mùi Pure Aroma 230g - cam kết hàng chính hãng  Sáp thơm với mùi hương tự nhiên tạo cảm giác sảng khoái giúp bạn nhanh chóng xóa tan mệt mỏi, đem lại một cảm giá...",39000.0,https://tiki.vn/product-p100253768.html?spid=100253770,4.8,Đồ Chơi - Mẹ & Bé,TIKI
73855656,Tã Quần Cao Cấp Moony Nhật Bản Bé Trai XL38 (38 Miếng) - Tặng 6 Miếng Trong Gói,"Tã Quần Moony Bé Trai Gói Đại XL (38 Miếng) với thun chân vừa vặn, ôm trọn cơ thể bé, hạn chế khoảng cách giữa tã và hai chân bé. Nhờ đó, tã quần Moony man giúp chống tràn tối đa, khô thoáng cả ngày ...",299000.0,https://tiki.vn/product-p73855656.html?spid=77451458,4.5,Đồ Chơi - Mẹ & Bé,TIKI
94762046,"Túi Trữ Sữa Mama's Choice, Túi Đựng Sữa Mẹ Loại 250ml và 120ml, Kiểm Định An Toàn Bởi Bureau Veritas, Hộp 30 Túi",TÚI TRỮ SỮA MAMA’S CHOICE – CHO MẸ TRỮ SỮA THỎA THÍCHTúi trữ sữa Mama's Choice 120ml - 250ml (Hộp 30 túi) dùng để chứa sữa mẹ trong ngăn lạnh hoặc ngăn đông. Mẹ có thể hút sữa trực tiếp vào túi trữ s...,115000.0,https://tiki.vn/product-p94762046.html?spid=94762049,5.0,Đồ Chơi - Mẹ & Bé,TIKI
147987171,"[HÀNG CAO CẤP - CÓ CHỌN SIZE] Cờ Cá Ngựa Nam Châm, Bộ Cờ Cá Ngựa Cao Cấp Kích Thước 28x28 và 38x38cm - Chính Hãng dododios",[HÀNG CAO CẤP - CÓ CHỌN SIZE] Cờ Cá Ngựa Nam ChâmBộ Cờ Cá Ngựa Cao Cấp Kích Thước 28x28 và 38x38cmChính Hãng dododios - Chất liệu: nhựa an toàn HDPE- ABS- Bàn cờ được làm theo công nghệ hiện đ...,84000.0,https://tiki.vn/product-p147987171.html?spid=147987175,4.5,Đồ Chơi - Mẹ & Bé,TIKI
198309657,Bộ quần áo siêu nhân bé trai lửng kèm choàng và mặt nạ B152 Mẫu mới nhất,"Bộ quần áo siêu nhân bé trai lửng kèm choàng và mặt nạ B152 (Mẫu mới nhất) hoạ tiết đặc trưng của từng siêu anh hùng, những bộ quần áo siêu nhân được ra đời nhằm thỏa sức tưởng tượng của các em nhỏ mu...",196770.0,https://tiki.vn/product-p198309657.html?spid=198309660,5.0,Đồ Chơi - Mẹ & Bé,TIKI
106548607,Đồ Chơi Gỗ Thông Minh- Đồ Chơi Hộp Thả Hình Kết Hợp Đập Bóng Vui Nhộn Cho Bé,"Theo nhiều nghiên cứu thì sự phát triển đầu đời của bé rất quan trọng, vì vậy giáo dục sớm cho trẻ hiện nay được các bậc phụ huynh đặc biệt chú trọng và quan tâm. Để bé có thể phát triển toàn diện về ...",139000.0,https://tiki.vn/product-p106548607.html?spid=106548608,4.7,Đồ Chơi - Mẹ & Bé,TIKI
153368506,xí ngầu 14 ly - 3 viên,"       - Xí ngầu nghệ hoa , sản phẩm chất lượng cao , khi đổ vào chén kiểu sẽ tạo ra tiếng kêu len ken ,gồm có 4 loại : 11ly-12ly-13ly-14ly .   ...",66000.0,https://tiki.vn/product-p153368506.html?spid=153368507,0.0,Đồ Chơi - Mẹ & Bé,TIKI
203910583,Đồ bơi bé gái tay dài quần dài chống nắng cao cấp,"Đồ bơi bé gái dài tay quần váy dài cực dễ thương. Mỗi bộ gồm 1 áo dài tay và 1 quần dài như hình. Chất thun bơi dày dặn, mịn đẹp, đường may chắc chắnLưu ý chọn size đồ bơi trẻ em:* XL: 16-19kg, cao ...",240000.0,https://tiki.vn/product-p203910583.html?spid=203910585,3.5,Đồ Chơi - Mẹ & Bé,TIKI
228495549,Nước Tẩy Trắng quần áo thế hệ mới D.WHITE - Tẩy mốc quần áo - 100% -Không làm hỏng màu quần áo ,"  Đánh bật mọi vết bẩn, vàng ố, mốc trên chăn ga – gối nệm chỉ trong 30 phút.   Sử dụng với nhiều loại chất liệu khác nhau như: cotton, lanh, polyester, acrylic mà không làm mỏng vải, khô vải.   B1...",59000.0,https://tiki.vn/product-p228495549.html?spid=228495555,4.0,Đồ Chơi - Mẹ & Bé,TIKI
103524399,04 bộ tranh xếp hình 35 mảnh khổ A4 20x30cm – đồ chơi trí tuệ cho bé từ 2 tuổi – Combo 2,"THÔNG TIN SẢN PHẨM : Combo 4 bộ gồm: Cars, Spiderman, Paw Patrol, Công trườngSố mảnh ghép: 35 mảnhKích thước hình xếp: khổ A4 20x30cm – Trình bày: Dạng bảngXuất xứ: Việt NamChất liệu: giấy bồi ...",75000.0,https://tiki.vn/product-p103524399.html?spid=103524400,4.8,Đồ Chơi - Mẹ & Bé,TIKI
89653612,Xe đạp xích lô bánh to như hình cho bé,       CHI TIẾT SẢN PHẨM   Xe Đạp Xích Lô 2 Ghế Cho Bé 2 - 6 Tuổi    Khung xe bằng thép sơn tĩnh điện chất lượng cao đảm bảo các tiêu chuẩn an toàn cho bé yêu.    Bánh xe đúc bằng xốp đặc ...,449000.0,https://tiki.vn/product-p89653612.html?spid=271222992,0.0,Đồ Chơi - Mẹ & Bé,TIKI
137563654,Sữa Bột Dành Cho Mẹ Bầu Anmum Materna Hương Vani 800g - Tặng bình nước thể thao,"Anmum Materna hương vani là sữa bột dinh dưỡng tốt nhất dành cho phụ nữ mang thai và cho con bú.Với các dưỡng chất Mind-Q Nutrient Bundle, Anmum Materna là một trong những sản phẩm sữa tốt nhất hiện ...",432000.0,https://tiki.vn/product-p137563654.html?spid=137563655,5.0,Đồ Chơi - Mẹ & Bé,TIKI
2983649,Sữa Bột Namyang Imperial Dream XO 4 GT 800g,"Sữa mẹ là thức ăn tốt nhất cho sức khỏe và sự phát triển toàn diện của trẻ sơ sinh và trẻ nhỏSữa Bột Namyang Imperial Dream XO 4 GT 800g dành cho trẻ từ 1 đến 3 tuổi có đến 59 thành phần dưỡng chất, ...",433300.0,https://tiki.vn/product-p2983649.html?spid=67315904,4.7,Đồ Chơi - Mẹ & Bé,TIKI
261989936,Đồ chơi đất nặn cơ bản màu đỏ 4oz Play-Doh,1.Tên sản phẩm : Đồ chơi đất nặn cơ bản màu đỏ 4oz Play-Doh2.Thương hiệu : Play-Doh3.Mã sản phẩm : E4830RE4.Mô tả sản phẩm : PLAY-DOH là thương hiệu đồ chơi đất nặn an toàn của Công ty Hasbro. Đất ...,29000.0,https://tiki.vn/product-p261989936.html?spid=261989937,2.0,Đồ Chơi - Mẹ & Bé,TIKI
44959788,Sữa Bột Namyang Imperial Mom XO GT 800g,"Sữa bột Imperial Mom XO GTSản phẩm sử dụng sữa nguyên chất, được làm từ nguồn sữa tươi lấy tại nông trại, không qua khâu lưu kho, sử dụng phương pháp đóng gói khí Nitơ để giữ trọn nguồn dinh dưỡng p...",528000.0,https://tiki.vn/product-p44959788.html?spid=67316910,4.5,Đồ Chơi - Mẹ & Bé,TIKI
90476592,15 lọ thuốc diệt kiến gián sinh học,       Thuốc diệt kiến gián tận gốc sinh học bảo châu   Dung tích lọ 10ml   Đảm bảo sạch hoàn toàn kiến gián sau khi sử dụng   Sản phẩm làm từ sinh học đảm bảo an toàn cho môi trường   Thời gi...,45000.0,https://tiki.vn/product-p90476592.html?spid=90476594,4.5,Đồ Chơi - Mẹ & Bé,TIKI
4328087,Combo 03 túi nước giặt kháng khuẩn Mao Bao 1800g, ...,229000.0,https://tiki.vn/product-p4328087.html?spid=4328089,5.0,Đồ Chơi - Mẹ & Bé,TIKI
33893853,"Xe trượt scooter Babyfast 3 bánh an toàn cho trẻ em của Babyhop chịu lực 90kg phù hợp cho cả bé trai và gái, bánh xe phát sáng vĩnh cửu, rèn luyện vận động, tăng chiều cao cho bé - Hàng chính hãng","Xe trượt scooter babyfast của Babyhop có thể gập gọn mang đi mọi địa hình:CHẤT LIỆU: NHỰA PU CAO CẤP, CHỊU LỰC LÊN ĐẾN 100KG THÍCH HỢP CHO CẢ BA MẸ CHƠI CÙNG BÉKÍCH THƯỚC XE TRƯỢT SCOOTER BABYFAST:...",599000.0,https://tiki.vn/product-p33893853.html?spid=33893862,4.8,Đồ Chơi - Mẹ & Bé,TIKI
2790345,"Muối ngâm chân thảo mộc giảm đau nhức, chống sưng phù, thơm tho bàn chân và thư giãn cơ thể Wonmom 350g","Wonmom là viết tắt của Wonderful -Mom- Người mẹ tuyệt vời. Đồng thời là quá khứ của từ “Win” Mom – Người mẹ chiến thắng. Với mong muốn chăm sóc sức khỏe và sắc đẹp cho mẹ cùng bé yêu, Wonmom đã cho ra...",85500.0,https://tiki.vn/product-p2790345.html?spid=2790347,4.6,Đồ Chơi - Mẹ & Bé,TIKI
198893993,"TẶNG QUÀ || Bộ Xếp Hình Nam Châm Cho Bé (36, 42, 64 chi tiết - mẫu mới) || Montessori cao cấp || Đồ chơi Gỗ - Giáo Dục - An toàn - Thông minh","AbiMon Kids xin phép được gửi lời chào thân yêu nhất đến Bố Mẹ đã tin tưởng và lựa chọn các sản phẩm, dịch vụ của Shop ạ.------------Nói KHÔNG với SMARTPHONE, TABLETNói KHÔNG với TV, LAPTOP, PCNói K...",210000.0,https://tiki.vn/product-p198893993.html?spid=258444205,0.0,Đồ Chơi - Mẹ & Bé,TIKI
19914619,Siro hỗ trợ phát triển não bộ và thị lực cho bé Doppelherz Aktiv Kinder Omega-3 Syrup (Chai 250ml),"Siro hỗ trợ phát triển não bộ và thị lực cho bé Doppelherz Aktiv Kinder Omega-3 Syrup (Chai 250ml)Kinder Omega-3 Syrup là sản phẩm từ Doppelherz - thương hiệu uy tín chiếm thị phần số 1 tại Đức, th...",478000.0,https://tiki.vn/product-p19914619.html?spid=19914620,4.8,Đồ Chơi - Mẹ & Bé,TIKI
195522369,Tã quần Merries First Premium đủ size M46/L36/XL32,"Tã quần Merries First Premium đủ size M46/L36/XL32 Merries First Premium là dòng sản phẩm mới siêu cao cấp với chất liệu mềm mại, thoáng khí và đặc biệt với chất liệu bề mặt chọn lọc tốt nhất an toà...",510000.0,https://tiki.vn/product-p195522369.html,5.0,Đồ Chơi - Mẹ & Bé,TIKI
119068590,"Xe tròn tập đi cho bé baby walk - xe dụng cụ tập đi có cán đẩy điều chỉnh cao thấp có nhạc,đèn","       Xe tròn tập đi cao cấp   - Xe được làm từ chất liệu nhựa và vải may an toàn không gây độc hại, tuyệt đối an toàn cho sức khỏe của trẻ nhỏ.   - Thiết kê khung xe rộng, hình tròn, chịu lực ...",295000.0,https://tiki.vn/product-p119068590.html?spid=120460486,4.5,Đồ Chơi - Mẹ & Bé,TIKI
155723630,Khăn Sữa Unmei 6 lớp 30x30cm - Khăn Lau cho Bé - Khăn Vải Xô - Dày dặn - Thấm Hút Tốt - Màu Trắng Hoa văn ngẫu nhiên,"Khăn xô 6 lớp , khăn rửa mặt cho bé , kích thước 30x30cmTHÔNG TIN SẢN PHẨM:- Thấm hút rất tốt, 6 lớp mềm mại.- Khăn xô tcho bé được làm từ cotton và sợi tre, cực kỳ mềm mại và thoáng mát, giúp cho ...",59000.0,https://tiki.vn/product-p155723630.html?spid=155723634,5.0,Đồ Chơi - Mẹ & Bé,TIKI
216336133,Đồ Chơi Cắt Giấy Thủ Công Tạo Hình Sáng Tạo 03 Cấp Độ Mideer Lets Cut Paper cho Bé 3 4 5 Tuổi,"̆́ ̂́ ̣ ̀      ̂́ Đ̣̂ - Đ̂̀ ̛ ̉ ̂ ́ ̣ ́ ̣  ́     ̂̉ - Đồ Chơi Trí Tuệ Giấy Thủ Công Cắt Dán 3 Cấp Độ - Let’s Cut Paper - được làm từ loại giấy cao cấp chống lóa, với độ dày nhất định giúp bé dễ dàng...",39000.0,https://tiki.vn/product-p216336133.html?spid=252131629,5.0,Đồ Chơi - Mẹ & Bé,TIKI
186118363,Sữa bột Vinamilk Dielac Alpha Gold 4  850g (cho trẻ từ 2- 6 tuổi),"Dielac Alpha Gold 4 với công thức COMPLET-IQ hỗ trợ PHÁT TRIỂN TOÀN DIỆN, bổ sung Sữa non 24h(*) nhập khẩu từ Mỹ giúp tăng sức đề kháng, cùng lợi khuẩn hỗ trợ hệ tiêu hóa khỏe; DHA, Choline, Lutein hỗ...",272000.0,https://tiki.vn/product-p186118363.html,5.0,Đồ Chơi - Mẹ & Bé,TIKI
263697350,Bộ đồ chơi nấu ăn nhà bếp cho bé gái cao cấp cỡ lớn nhả khói như thật MySun,"Bố mẹ đang muốn tìm cho con những món đồ chơi khơi dậy khả năng hoạt bát, nhạy bén trong những hoạt động hằng ngày của con. Không muốn con tiếp xúc quá nhiều với các thiết bị điện tử như: tivi, điện t...",225000.0,https://tiki.vn/product-p263697350.html?spid=263697352,0.0,Đồ Chơi - Mẹ & Bé,TIKI
5853987,10 Khăn Sữa Cao Cấp Nanis 4 Lớp (25 x 30 cm),"10 Khăn Sữa Cao Cấp Nanis 4 Lớp với thành phần 100% cotton mềm mại thấm hút tốt, không xù lông, xô lệch khi dùng với máy giặt.Sản phẩm có đường viền cuốn biên đều và chắc chắn.Khăn không chứa Formal...",45000.0,https://tiki.vn/product-p5853987.html?spid=6308253,4.3,Đồ Chơi - Mẹ & Bé,TIKI
103578279,Lọ Thả Tẩy Bồn Cầu Hàn Quốc Hương Hoa,"       Lọ Thả Tẩy Bồn Cầu Hàn Quốc Hương Hoa   TÁC DỤNG ĐẶC BIỆT :   - Khử trùng, khử mùi, sạch, sang trọng.   - Duy trì độ sáng của gốm, chống ăn mòn, không cần cọ rửa, không gây xước men....",38900.0,https://tiki.vn/product-p103578279.html?spid=184317353,4.8,Đồ Chơi - Mẹ & Bé,TIKI
412757,Tã Dán Cao Cấp Moony Nhật Bản M64 (64 Miếng),"Tã Dán Moony Size M 64 Miếng là sản phẩm cao cấp được sản xuất theo công nghệ hiện đại nhất hiện nay, đáp ứng được tất cả những yêu cầu về chất lượng cũng như tiêu chuẩn về an toàn cho bé yêu của bạn....",287900.0,https://tiki.vn/product-p412757.html?spid=25494810,4.5,Đồ Chơi - Mẹ & Bé,TIKI
49498423,Combo 2 bịch bỉm/tã quần cao cấp MIJUKU,"Lần đầu tiên trên thị trường Việt Nam xuất hiện dòng sản phẩm tã bỉm MIJUKU mang đậm phong các Nhật Bản, chất lượng tầm cỡ Nhật Bản.Đây là dòng sản phẩm được đánh giá rất cao, là sản phẩm mềm nhất, m...",350000.0,https://tiki.vn/product-p49498423.html?spid=56699749,4.7,Đồ Chơi - Mẹ & Bé,TIKI
543122,Nước Giặt Quần Áo Em Bé D-nee Hương Lavender 3L - [8851989061535],Dung Dịch Giặt Quần Áo Cho Bé D-Nee - Chai 3000ml (Tím) với hương thơm nhẹ nhàng từ những cánh hoa lavender kết hợp cùng công thức đặc biệt giúp thổi bay vết bẩn hiệu quả. Dung tích 3000ml giúp mẹ tiế...,215000.0,https://tiki.vn/product-p543122.html?spid=74983743,5.0,Đồ Chơi - Mẹ & Bé,TIKI
15519960,Men Vi Sinh Xử Lý Hầm Cầu Ecoclean septic 1 gói 100g,"ECOCLEAN SEPTIC - MEN VI SINH XỬ LÝ HẦM CẦU BỂ PHỐT là sản phẩm tuyệt vời chuyên “trị” tắc nghẽn bể phốt (hầm tự hoại), xử lý bồn cầu bị nghẹt, bốc mùi hôi, … được người dùng đánh giá cao trên thị trư...",80000.0,https://tiki.vn/product-p15519960.html?spid=31696796,4.3,Đồ Chơi - Mẹ & Bé,TIKI
143778813,Cờ tỷ phú Monopoly - Việt Nam Phiên Bản cao cấp,"       Trong cuộc sống tấp nập ngày nay, đôi khi bạn muốn có thời gian gần gũi hơn với gia đình và bạn bè. Một lựa chọn hợp lý nhất đó chính là Cờ Tỷ Phú - một trò chơi quá đỗi quen thuộc mà ai cũ...",351000.0,https://tiki.vn/product-p143778813.html?spid=143778817,5.0,Đồ Chơi - Mẹ & Bé,TIKI
66193472,"Bộ 2 tấm tranh xếp hình đội chó cứu hộ và Heo Peppa, 48 mảnh ghép, kích thước A3. Tia Sáng Việt Nam.","Sản phẩm gồm 2 bộ xếp hình được dập từ khổ A3, Thành phẩm có kích thước:  260 x 360 mm. Mỗi tấm gồm 48 mảnh ghép.Một sản phẩm tranh phim hoạt hình các bé yêu thích Đội chó cứu hộ và Hep PeppaKhổ ...",78000.0,https://tiki.vn/product-p66193472.html?spid=66193473,4.8,Đồ Chơi - Mẹ & Bé,TIKI
249016577,Boardgame bài Meme 150 lá vui nhộn cho nhóm bạn thân,"Boardgame bài Meme 150 lá vui nhộn cho nhóm bạn thânSố người chơi 3-10 ngườiBộ bài gồm 70 lá caption là những tình huống trong cuộc sống, 80 lá meme là biểu cảm / phản ứng của người chơi đối với tình ...",109000.0,https://tiki.vn/product-p249016577.html?spid=249016578,4.5,Đồ Chơi - Mẹ & Bé,TIKI
52657773,Bộ 3 bình trữ sữa mẹ cổ rộng Fatzbaby 150ml + tặng 5 zipper 10x15cm,"Bình trữ sữa vật dụng không thể thiếu trong quá trình nuôi con bằng sữa mẹ, giúp mẹ trữ sữa khi hút sữa mà chưa cho bé bú ngay, trữ trong tủ lạnh, trữ trong bình giữ nhiệt khi đi xa.1. CÔNG D...",109000.0,https://tiki.vn/product-p52657773.html?spid=52657776,4.6,Đồ Chơi - Mẹ & Bé,TIKI
